{
  "contract_version": "reference_machine_contract_v1",
  "domain": "tarot",
  "entity_code": "tarot.major.13",
  "version": "0.1.0",
  "status": "draft",
  "machine_contract": {
    "vector": {
      "action_reflection": 0.32,
      "expansion_consolidation": -0.68,
      "self_others": -0.18,
      "structure_flow": 0.42
    },
    "tempo": "dynamic",
    "risk": "medium",
    "risk_modifier": 0.32,
    "emotional_load": "intense",
    "confidence": 0.82
  }
}
