{
  "contract_version": "reference_machine_contract_v1",
  "domain": "tarot",
  "entity_code": "tarot.major.21",
  "version": "0.1.0",
  "status": "draft",
  "machine_contract": {
    "vector": {
      "action_reflection": 0.38,
      "expansion_consolidation": -0.55,
      "self_others": 0.32,
      "structure_flow": 0.62
    },
    "tempo": "steady",
    "risk": "low",
    "risk_modifier": -0.1,
    "emotional_load": "calm",
    "confidence": 0.94
  }
}
