{
  "contract_version": "reference_machine_contract_v1",
  "domain": "numerology",
  "entity_code": "numerology.personal_year.1",
  "entity_type": "PersonalYear",
  "version": "0.1.0",
  "status": "draft",
  "machine_contract": {
    "vector": {
      "action_reflection": 0.75,
      "expansion_consolidation": 0.47,
      "self_others": 0.2,
      "structure_flow": -0.5
    },
    "tempo": "steady",
    "risk": "medium",
    "risk_modifier": 0.25,
    "emotional_load": "neutral",
    "confidence": 0.95
  }
}
