{
  "contract_version": "reference_machine_contract_v1",
  "domain": "numerology",
  "entity_code": "numerology.personal_month.8",
  "entity_type": "PersonalMonth",
  "version": "0.1.0",
  "status": "draft",
  "machine_contract": {
    "vector": {
      "action_reflection": 0.6,
      "expansion_consolidation": 0.4,
      "self_others": 0.1,
      "structure_flow": 0.75
    },
    "tempo": "steady",
    "risk": "medium",
    "risk_modifier": 0.15,
    "emotional_load": "neutral",
    "confidence": 0.95
  }
}
