{
  "contract_version": "reference_machine_contract_v1",
  "domain": "numerology",
  "entity_code": "numerology.personal_day.5",
  "entity_type": "PersonalDay",
  "version": "0.1.0",
  "status": "draft",
  "machine_contract": {
    "vector": {
      "action_reflection": 0.55,
      "expansion_consolidation": 0.8,
      "self_others": 0.3,
      "structure_flow": -0.7
    },
    "tempo": "fast",
    "risk": "high",
    "risk_modifier": 0.45,
    "emotional_load": "intense",
    "confidence": 1.0
  }
}
