{
  "contract_version": "reference_machine_contract_v1",
  "domain": "numerology",
  "entity_code": "numerology.personal_day.7",
  "entity_type": "PersonalDay",
  "version": "0.1.0",
  "status": "draft",
  "machine_contract": {
    "vector": {
      "action_reflection": -0.3,
      "expansion_consolidation": 0.0,
      "self_others": -0.4,
      "structure_flow": 0.2
    },
    "tempo": "dynamic",
    "risk": "low",
    "risk_modifier": 0.0,
    "emotional_load": "neutral",
    "confidence": 1.0
  }
}
