{
  "contract_version": "reference_machine_contract_v1",
  "domain": "astrology",
  "entity_code": "astrology.sign.pisces",
  "entity_type": "ZodiacSign",
  "version": "0.1.0",
  "status": "draft",
  "machine_contract": {
    "vector": {
      "action_reflection": -0.4,
      "expansion_consolidation": 0.25,
      "self_others": 0.5,
      "structure_flow": -0.6
    },
    "tempo": "steady",
    "risk": "low",
    "risk_modifier": 0.1,
    "emotional_load": "calm",
    "confidence": 0.88
  }
}
