{
  "contract_version": "reference_machine_contract_v1",
  "domain": "astrology",
  "entity_code": "astrology.house.08",
  "entity_type": "House",
  "version": "0.1.0",
  "status": "draft",
  "machine_contract": {
    "vector": {
      "action_reflection": 0.2,
      "expansion_consolidation": 0.05,
      "self_others": 0.3,
      "structure_flow": 0.55
    },
    "tempo": "steady",
    "risk": "high",
    "risk_modifier": 0.45,
    "emotional_load": "intense",
    "confidence": 0.84
  }
}
