{
  "contract_version": "reference_machine_contract_v1",
  "domain": "astrology",
  "entity_code": "astrology.sign.gemini",
  "entity_type": "ZodiacSign",
  "version": "0.1.0",
  "status": "draft",
  "machine_contract": {
    "vector": {
      "action_reflection": 0.25,
      "expansion_consolidation": 0.35,
      "self_others": 0.55,
      "structure_flow": -0.5
    },
    "tempo": "dynamic",
    "risk": "low",
    "risk_modifier": 0.05,
    "emotional_load": "neutral",
    "confidence": 0.87
  }
}
