{
  "contract_version": "reference_machine_contract_v1",
  "domain": "astrology",
  "entity_code": "astrology.planet.venus",
  "entity_type": "Planet",
  "version": "0.1.0",
  "status": "draft",
  "machine_contract": {
    "vector": {
      "action_reflection": -0.15,
      "expansion_consolidation": 0.35,
      "self_others": 0.8,
      "structure_flow": 0.2
    },
    "tempo": "steady",
    "risk": "low",
    "risk_modifier": -0.1,
    "emotional_load": "calm",
    "confidence": 0.91
  }
}
