{
  "contract_version": "reference_machine_contract_v1",
  "domain": "astrology",
  "entity_code": "astrology.house.06",
  "entity_type": "House",
  "version": "0.1.0",
  "status": "draft",
  "machine_contract": {
    "vector": {
      "action_reflection": 0.15,
      "expansion_consolidation": -0.2,
      "self_others": 0.1,
      "structure_flow": 0.75
    },
    "tempo": "steady",
    "risk": "low",
    "risk_modifier": 0.05,
    "emotional_load": "neutral",
    "confidence": 0.87
  }
}
