{
  "contract_version": "reference_machine_contract_v1",
  "domain": "astrology",
  "entity_code": "astrology.sign.leo",
  "entity_type": "ZodiacSign",
  "version": "0.1.0",
  "status": "draft",
  "machine_contract": {
    "vector": {
      "action_reflection": 0.55,
      "expansion_consolidation": 0.6,
      "self_others": 0.45,
      "structure_flow": -0.3
    },
    "tempo": "dynamic",
    "risk": "medium",
    "risk_modifier": 0.2,
    "emotional_load": "intense",
    "confidence": 0.88
  }
}
