{
  "contract_version": "reference_machine_contract_v1",
  "domain": "numerology",
  "entity_code": "numerology.personal_month.6",
  "entity_type": "PersonalMonth",
  "version": "0.1.0",
  "status": "draft",
  "machine_contract": {
    "vector": {
      "action_reflection": -0.2,
      "expansion_consolidation": 0.3,
      "self_others": 0.78,
      "structure_flow": 0.5
    },
    "tempo": "steady",
    "risk": "low",
    "risk_modifier": -0.04,
    "emotional_load": "calm",
    "confidence": 0.95
  }
}
