{
  "contract_version": "reference_machine_contract_v1",
  "domain": "numerology",
  "entity_code": "numerology.master.11",
  "entity_type": "MasterNumber",
  "version": "0.1.0",
  "status": "draft",
  "machine_contract": {
    "vector": {
      "action_reflection": -0.5,
      "expansion_consolidation": 0.5,
      "self_others": 0.35,
      "structure_flow": -0.35
    },
    "tempo": "dynamic",
    "risk": "medium",
    "risk_modifier": 0.3,
    "emotional_load": "intense",
    "confidence": 0.95
  }
}
