{
  "contract_version": "reference_machine_contract_v1",
  "domain": "astrology",
  "entity_code": "astrology.planet.uranus",
  "entity_type": "Planet",
  "version": "0.1.0",
  "status": "draft",
  "machine_contract": {
    "vector": {
      "action_reflection": 0.4,
      "expansion_consolidation": 0.55,
      "self_others": 0.2,
      "structure_flow": -0.7
    },
    "tempo": "fast",
    "risk": "high",
    "risk_modifier": 0.4,
    "emotional_load": "intense",
    "confidence": 0.84
  }
}
